<?xml version="1.0" encoding="UTF-8" ?>

<mapper xmlns="http://batis.harvey.org/schema/config"
        xmlns:xsi="http://www.w3.org/2001/XMLSchema-instance"
        xsi:schemaLocation="http://batis.harvey.org/schema/config
                            https://batis.harvey.org/schema/config/yourbatis-mapper.xsd"
        target="org.harvey.batis.demo.mapper.EmployeeMapper"><!--名字写代理接口-->

    <result-map id="EmployeeResultMap" java-entity-type="org.harvey.batis.demo.entity.Employee">
        <result table-column="id" java-field="id"/>
        <result table-column="first_name" java-field="firstName"/>
        <result table-column="firstName" java-field="firstName"/>
        <result table-column="name" java-field="firstName"/>
    </result-map>
    <!--id是这一句命令的唯一标识,不能重复-->
    <select method-name="selectAll" result-map="EmployeeResultMap">
        <!--起了别名之后就方便了-->
        SELECT id,
        name as first_name
        FROM tb_employee
    </select>
    <select method-name="select" result-map="EmployeeResultMap">
        <!--起了别名之后就方便了-->
        SELECT id,
        name as first_name
        FROM tb_employee where id=#{id} and name=#{firstName}
    </select>
    <select method-name="selectById"
            result-map="EmployeeResultMap EmployeeResultMap EmployeeResultMap EmployeeResultMap">
        <!--起了别名之后就方便了-->
        SELECT id,
        name as firstName
        FROM tb_employee where id=#{id};
        SELECT id,
        name as firstName
        FROM tb_employee where id=#{id};
        SELECT id,
        name as firstName
        FROM tb_employee where id=#{id};
        <if match="id==1">
            SELECT id,
            name as firstName
            FROM tb_employee where id=#{id};
        </if>
    </select>
    <select method-name="selectByIds" result-map="EmployeeResultMap">
        <!--起了别名之后就方便了-->
        SELECT id,
        name
        FROM tb_employee where id in
        <foreach collection="ids"
                 separator="," open="(" close=")" item="id" index="i">
            #{ id }
        </foreach>
        ;
    </select>
    <delete method-name="delById">
        delete from tb_employee where id=#{id} ;
    </delete>
    <!--
    List<Employee> orderByAsc(@Param("column") String column);
    List<Employee> orderByDesc(@Param("column") String column);
    List<Employee> dividePage(@Param("start") int start, @Param("len") int len);
    int getLen();
    int addEmployee(Employee employee);
    int delById(int id);
    int delByIds(int[] ids);
    int updateByMessage(@Param("id") int id, @Param("customerId") int customerId, @Param("employeeDate") Date employeeDate);
    int update(Employee employee);-->
</mapper>